{
  "id": "task-1-update-the-create-and-update-command-flows-so-function-payloads-are-acc-865ce72a",
  "text": "Update the create and update command flows so `function` payloads are accepted and routed through the reusable CRUD client without applying request-only validation to function JSON.",
  "goalId": "goal-add-function-capabilities-to-apiease-cli-just-as-the-cli-already-suppor-d169e4aa",
  "goal": "Add function capabilities to apiease-cli just as the CLI already supports request, widget, and variable resources.\n\nGoal\n\nExtend the CLI, shared resource model, reusable client transport, help text, README examples, and automated coverage so function becomes a first-class CRUD resource.\n\nScope\n\nAdd function to the supported CRUD resource list alongside request, widget, and variable.\nUse the canonical APIEase resource collection path /api/v1/resources/functions.\nUse the canonical item identifier shape functionId at the API layer and --function-id at the CLI layer.\nSupport these command shapes:\napiease create function --file <path> [--base-url <url>] [--shop-domain <shop-domain>] [--api-key <api-key>] [--json]\napiease read function --function-id <id> [--base-url <url>] [--shop-domain <shop-domain>] [--api-key <api-key>] [--json]\napiease update function --function-id <id> --file <path> [--base-url <url>] [--shop-domain <shop-domain>] [--api-key <api-key>] [--json]\napiease delete function --function-id <id> [--base-url <url>] [--shop-domain <shop-domain>] [--api-key <api-key>] [--json]\nRequirements\n\nMirror the same resource-aware patterns already used for request, widget, and variable support.\nExtend the shared CRUD resource definition layer so it knows the function CLI token, API path segment, response payload key, human-readable label, and canonical identifier flag.\nRoute function CRUD operations through the reusable client-side CRUD transport in src/client rather than introducing function-specific business logic in bin entrypoints.\nPreserve existing request-specific validation behavior for request create and update flows without forcing request-only validation onto function payloads.\nUpdate create, read, update, and delete command parsing so function is accepted anywhere the other supported resources are accepted.\nRequire --function-id for read, update, and delete function flows before any API call is attempted.\nKeep the CLI verb-first. Do not switch to a resource-first command structure.\nUpdate top-level usage output, per-command help text, success messages, failure messages, and README examples so function appears consistently with request, widget, and variable.\nPreserve current request, widget, and variable behavior with no compatibility regressions.\nAcceptance criteria\n\nThe CLI accepts create, read, update, and delete for function using the same public command structure as the existing supported resources.\nFunction CRUD traffic goes to the versioned function resource endpoints under /api/v1/resources/functions.\nMissing or unsupported resources fail fast with usage-level output.\nFunction read, update, and delete fail fast with usage-level output when --function-id is missing.\nAutomated coverage includes positive function command cases and negative cases for missing resource, unsupported resource, and missing --function-id.",
  "project": "apiease-cli",
  "status": "complete",
  "priority": "high",
  "tags": [
    "cli",
    "create",
    "update"
  ],
  "createdBy": "kevin",
  "createdAt": "2026-03-31T23:46:17Z",
  "updatedAt": "2026-03-31T23:58:55Z",
  "context": [
    "`src/cli/CreateRequestCommand.js` and `src/cli/UpdateRequestCommand.js` already special-case request operations and delegate non-request resources to `ApiEaseCrudResourceClient`.",
    "The goal requires `apiease create function --file <path>` and `apiease update function --function-id <id> --file <path>` to work with the existing verb-first CLI shape."
  ],
  "steps": [
    "Accept `function` anywhere the create and update commands currently validate supported resources.",
    "Require `--function-id` for `update function` before any API call is attempted, while keeping `--file` required for both create and update.",
    "Route function create and update requests through `ApiEaseCrudResourceClient` with function-specific error codes and human-readable output derived from the shared resource metadata."
  ],
  "constraints": [
    "Preserve the current request-specific create/update validation flow for `request` resources.",
    "Do not force request contract validation onto function payloads."
  ],
  "acceptanceCriteria": [
    "`apiease create function --file <path> ...` uses the shared CRUD client path for function resources and emits function-aware success or failure output.",
    "`apiease update function --function-id <id> --file <path> ...` fails fast with usage-level output when `--function-id` is missing.",
    "Existing `request`, `widget`, and `variable` create/update behavior remains compatible."
  ],
  "sequenceIndex": 1,
  "codexSettings": {
    "workingDirectory": ".",
    "branchStrategy": "current",
    "maxRuns": 1
  },
  "result": {
    "summary": "",
    "notes": [],
    "completedAt": null
  }
}
