{
  "id": "task-2-update-the-read-and-delete-command-flows-so-function-is-a-supported-cru-f89179e3",
  "text": "Update the read and delete command flows so `function` is a supported CRUD resource and `--function-id` is required before any configuration or API work begins.",
  "goalId": "goal-add-function-capabilities-to-apiease-cli-just-as-the-cli-already-suppor-d169e4aa",
  "goal": "Add function capabilities to apiease-cli just as the CLI already supports request, widget, and variable resources.\n\nGoal\n\nExtend the CLI, shared resource model, reusable client transport, help text, README examples, and automated coverage so function becomes a first-class CRUD resource.\n\nScope\n\nAdd function to the supported CRUD resource list alongside request, widget, and variable.\nUse the canonical APIEase resource collection path /api/v1/resources/functions.\nUse the canonical item identifier shape functionId at the API layer and --function-id at the CLI layer.\nSupport these command shapes:\napiease create function --file <path> [--base-url <url>] [--shop-domain <shop-domain>] [--api-key <api-key>] [--json]\napiease read function --function-id <id> [--base-url <url>] [--shop-domain <shop-domain>] [--api-key <api-key>] [--json]\napiease update function --function-id <id> --file <path> [--base-url <url>] [--shop-domain <shop-domain>] [--api-key <api-key>] [--json]\napiease delete function --function-id <id> [--base-url <url>] [--shop-domain <shop-domain>] [--api-key <api-key>] [--json]\nRequirements\n\nMirror the same resource-aware patterns already used for request, widget, and variable support.\nExtend the shared CRUD resource definition layer so it knows the function CLI token, API path segment, response payload key, human-readable label, and canonical identifier flag.\nRoute function CRUD operations through the reusable client-side CRUD transport in src/client rather than introducing function-specific business logic in bin entrypoints.\nPreserve existing request-specific validation behavior for request create and update flows without forcing request-only validation onto function payloads.\nUpdate create, read, update, and delete command parsing so function is accepted anywhere the other supported resources are accepted.\nRequire --function-id for read, update, and delete function flows before any API call is attempted.\nKeep the CLI verb-first. Do not switch to a resource-first command structure.\nUpdate top-level usage output, per-command help text, success messages, failure messages, and README examples so function appears consistently with request, widget, and variable.\nPreserve current request, widget, and variable behavior with no compatibility regressions.\nAcceptance criteria\n\nThe CLI accepts create, read, update, and delete for function using the same public command structure as the existing supported resources.\nFunction CRUD traffic goes to the versioned function resource endpoints under /api/v1/resources/functions.\nMissing or unsupported resources fail fast with usage-level output.\nFunction read, update, and delete fail fast with usage-level output when --function-id is missing.\nAutomated coverage includes positive function command cases and negative cases for missing resource, unsupported resource, and missing --function-id.",
  "project": "apiease-cli",
  "status": "complete",
  "priority": "high",
  "tags": [
    "cli",
    "read",
    "delete"
  ],
  "createdBy": "kevin",
  "createdAt": "2026-03-31T23:46:18Z",
  "updatedAt": "2026-04-01T00:01:49Z",
  "context": [
    "`src/cli/ReadRequestCommand.js` and `src/cli/DeleteRequestCommand.js` already drive identifier parsing, usage text, and human-readable output from the shared resource metadata.",
    "The goal requires `apiease read function --function-id <id>` and `apiease delete function --function-id <id>` to behave like the existing widget and variable flows."
  ],
  "steps": [
    "Accept `function` in read and delete resource parsing wherever the other supported CRUD resources are accepted.",
    "Require `--function-id` for function read and delete flows and pass that value through as the resource identifier to the generic CRUD client.",
    "Ensure read/delete usage text, success messages, and failure messages describe Function and Function ID consistently."
  ],
  "constraints": [
    "Preserve the current JSON output mode contract.",
    "Keep non-request read/delete traffic on the reusable CRUD transport in `src/client`."
  ],
  "acceptanceCriteria": [
    "`apiease read function --function-id <id> ...` and `apiease delete function --function-id <id> ...` route through the reusable CRUD client for function resources.",
    "Missing `--function-id` on function read or delete fails fast with usage-level output before any API call is attempted.",
    "Existing request, widget, and variable read/delete behavior remains unchanged."
  ],
  "sequenceIndex": 2,
  "codexSettings": {
    "workingDirectory": ".",
    "branchStrategy": "current",
    "maxRuns": 1
  },
  "result": {
    "summary": "",
    "notes": [],
    "completedAt": null
  }
}
