{
  "id": "task-1-wire-the-node-client-s-authentication-resolution-to-use-the-reusable-ho-ffcca590",
  "text": "Wire the Node client's authentication resolution to use the reusable home-configuration layer whenever `--api-key` is not explicitly provided.",
  "goalId": "goal-introduce-a-reusable-home-configuration-layer-in-the-node-client-so-api-57bdd527",
  "goal": "introduce a reusable home-configuration layer in the Node client so apiease-cli reads the active environment from ~/.apiease/environment, validates that it is local, staging, or production, loads the matching ~/.apiease/.env.<environment> file, resolves APIEASE_API_KEY from that file, and uses it whenever --api-key is not explicitly passed. Keep explicit CLI flags as the highest-precedence overrides, keep the bash wrapper thin, fail fast with clear structured errors when the environment declaration is missing or invalid or when the selected env file is missing or lacks APIEASE_API_KEY, and update tests and README so the new ~/.apiease environment-selection and env-file authentication flow is fully covered and documented.",
  "project": "apiease-cli",
  "status": "complete",
  "priority": "urgent",
  "tags": [
    "cli",
    "auth",
    "integration"
  ],
  "createdBy": "kevin",
  "createdAt": "2026-03-14T23:48:32Z",
  "updatedAt": "2026-03-15T00:34:41Z",
  "context": [
    "Explicit CLI flags must remain the highest-precedence override.",
    "The new fallback behavior should be centralized rather than duplicated per command."
  ],
  "steps": [
    "Update the command option/authentication flow to check for an explicit `--api-key` first.",
    "When `--api-key` is absent, resolve the API key through the new home-configuration component.",
    "Surface configuration failures through the CLI's structured error path."
  ],
  "constraints": [
    "Do not change the behavior of explicitly provided CLI flags.",
    "Do not introduce a second auth-resolution path outside the Node client."
  ],
  "acceptanceCriteria": [
    "If `--api-key` is passed, the CLI uses that value and does not require `~/.apiease` configuration.",
    "If `--api-key` is omitted, the CLI loads `APIEASE_API_KEY` from the active home environment configuration.",
    "Configuration failures stop execution immediately and present the structured error output produced by the Node client."
  ],
  "sequenceIndex": 1,
  "codexSettings": {
    "workingDirectory": ".",
    "branchStrategy": "current",
    "maxRuns": 1
  },
  "result": {
    "summary": "",
    "notes": [],
    "completedAt": "2026-03-15T00:34:41Z"
  }
}
