{
  "id": "task-4-update-top-level-cli-routing-and-usage-help-so-crud-verbs-dispatch-by-v-ffd32279",
  "text": "Update top-level CLI routing and usage/help so CRUD verbs dispatch by verb plus resource while `init` and `upgrade` remain verb-only.",
  "goalId": "goal-implement-an-explicit-resource-subcommand-cli-shape-for-crud-commands-i-0b5bb6d9",
  "goal": "Implement an explicit resource-subcommand CLI shape for CRUD commands in .\n\nScope:\n- Change the CLI so CRUD commands require a resource name immediately after the verb.\n- Supported resources for this change are , , and .\n- Examples of the intended command shape:\n  - \n  - \n  - \n  - \n  - \n  - \n  - \n  - \n  - \n  - \n  - \n  - \n\nRequirements:\n- Do not preserve backward compatibility for bare commands like  or .\n- Update top-level command routing, per-command argument parsing, usage/help text, and README examples/documentation to reflect the new required resource argument.\n- Keep the CLI verb-first. Do not switch to a resource-first structure like .\n- Align command naming, help text, exit behavior, and tests with the new explicit resource requirement.\n- Add or update tests for both valid and invalid command shapes.\n- Follow the repository’s required TDD workflow, including the full test suite run before edits and again after completion.",
  "project": "apiease-cli",
  "status": "complete",
  "priority": "high",
  "tags": [
    "cli",
    "entrypoint",
    "routing"
  ],
  "createdBy": "kevin",
  "createdAt": "2026-03-27T17:23:13Z",
  "updatedAt": "2026-03-27T17:59:26Z",
  "context": [
    "`bin/apiease-cli.js` currently resolves CRUD commands from only the first token and advertises request-only command descriptions.",
    "The new contract requires the second token to be mandatory for CRUD verbs, but not for `init` or `upgrade`."
  ],
  "steps": [
    "Change top-level command resolution so CRUD verbs validate and consume the resource token before delegating.",
    "Refresh top-level usage/help text to describe the supported verb-resource combinations.",
    "Keep unexpected runtime error handling and exit-code behavior aligned with the existing entrypoint contract."
  ],
  "constraints": [
    "Do not preserve backward compatibility for old bare CRUD shapes.",
    "Keep business logic in `src/` and leave `bin/apiease-cli.js` as thin wiring."
  ],
  "acceptanceCriteria": [
    "Top-level routing accepts `create|read|update|delete` only when followed by `request|widget|variable`.",
    "Missing command, missing CRUD resource, unknown resource, and unknown command all fail with non-zero usage-level output.",
    "`init` and `upgrade` continue to route without requiring a resource token."
  ],
  "sequenceIndex": 4,
  "codexSettings": {
    "workingDirectory": ".",
    "branchStrategy": "current",
    "maxRuns": 1
  },
  "result": {
    "summary": "",
    "notes": [],
    "completedAt": null
  }
}
