{
  "id": "task-0-add-a-reusable-node-side-home-configuration-component-that-resolves-the-c3d13a35",
  "text": "Add a reusable Node-side home-configuration component that resolves the active APIEase environment and API key from the user's `~/.apiease` directory.",
  "goalId": "goal-introduce-a-reusable-home-configuration-layer-in-the-node-client-so-api-57bdd527",
  "goal": "introduce a reusable home-configuration layer in the Node client so apiease-cli reads the active environment from ~/.apiease/environment, validates that it is local, staging, or production, loads the matching ~/.apiease/.env.<environment> file, resolves APIEASE_API_KEY from that file, and uses it whenever --api-key is not explicitly passed. Keep explicit CLI flags as the highest-precedence overrides, keep the bash wrapper thin, fail fast with clear structured errors when the environment declaration is missing or invalid or when the selected env file is missing or lacks APIEASE_API_KEY, and update tests and README so the new ~/.apiease environment-selection and env-file authentication flow is fully covered and documented.",
  "project": "apiease-cli",
  "status": "complete",
  "priority": "urgent",
  "tags": [
    "cli",
    "config",
    "auth"
  ],
  "createdBy": "kevin",
  "createdAt": "2026-03-14T23:48:31Z",
  "updatedAt": "2026-03-15T00:34:41Z",
  "context": [
    "This layer should become the single Node-client source of truth for home-directory configuration.",
    "Supported environment values are `local`, `staging`, and `production`."
  ],
  "steps": [
    "Read the active environment from `~/.apiease/environment`.",
    "Validate that the declared environment is one of the supported values.",
    "Resolve the matching `~/.apiease/.env.<environment>` file.",
    "Load `APIEASE_API_KEY` from the selected env file."
  ],
  "constraints": [
    "Keep the implementation reusable from multiple Node-side commands or services.",
    "Do not depend on shell-side sourcing or wrapper logic.",
    "Fail fast with structured configuration errors instead of silent fallbacks."
  ],
  "acceptanceCriteria": [
    "A valid `~/.apiease/environment` value of `local`, `staging`, or `production` resolves the matching `~/.apiease/.env.<environment>` file.",
    "If `~/.apiease/environment` is missing or invalid, the component returns a structured error that includes a stable code, a clear message, and the relevant file path.",
    "If the selected env file is missing, the component returns a structured error that identifies the missing file.",
    "If the selected env file does not define a non-empty `APIEASE_API_KEY`, the component returns a structured error that identifies the missing setting.",
    "On success, the component exposes the resolved environment and API key for downstream CLI use."
  ],
  "sequenceIndex": 0,
  "codexSettings": {
    "workingDirectory": ".",
    "branchStrategy": "current",
    "maxRuns": 1
  },
  "result": {
    "summary": "",
    "notes": [],
    "completedAt": "2026-03-15T00:34:41Z"
  }
}
